{
  "formatVersion": "0.9",
  "units": {
    "distance": "meter",
    "time": "second"
  },
  "laneGraph": {
    "edges": [
      {
        "id": "entry",
        "length": 100.0,
        "speedLimit": 30.0,
        "connections": [
          { "toEdgeId": "through" },
          { "toEdgeId": "bypass" }
        ]
      },
      {
        "id": "through",
        "length": 40.0,
        "speedLimit": 30.0,
        "connections": []
      },
      {
        "id": "bypass",
        "length": 30.0,
        "speedLimit": 30.0,
        "connections": []
      }
    ]
  },
  "junctions": [
    {
      "id": "junction-main"
    }
  ],
  "movements": [
    {
      "id": "movement-controlled",
      "junctionId": "junction-main"
    },
    {
      "id": "movement-uncontrolled",
      "junctionId": "junction-main"
    }
  ],
  "maneuverPaths": [
    {
      "id": "path-controlled",
      "movementId": "movement-controlled",
      "entryEdgeId": "entry",
      "internalEdgeIds": [],
      "exitEdgeId": "through"
    },
    {
      "id": "path-uncontrolled",
      "movementId": "movement-uncontrolled",
      "entryEdgeId": "entry",
      "internalEdgeIds": [],
      "exitEdgeId": "bypass"
    }
  ],
  "routes": [
    {
      "id": "controlled-route",
      "edgeIds": ["entry", "through"]
    },
    {
      "id": "uncontrolled-route",
      "edgeIds": ["entry", "bypass"]
    }
  ],
  "vehicleProfiles": [
    {
      "id": "passenger-car",
      "length": 4.5,
      "model": "iidm",
      "desiredSpeed": 13.9,
      "minGap": 2.0,
      "timeHeadway": 1.5,
      "maxAcceleration": 1.5,
      "comfortableDeceleration": 2.0,
      "emergencyDeceleration": 6.0,
      "participantClassId": "motorVehicle"
    }
  ],
  "participantClasses": [{ "id": "motorVehicle" }],
  "facilityBands": [],
  "roadSections": [
    {
      "id": "section-main",
      "kindId": "motorLane",
      "lanes": [{ "edgeIds": ["entry", "through"] }]
    }
  ],
  "laneGroups": [],
  "roadCorridors": [
    {
      "id": "corridor-main",
      "referenceSectionId": "section-main",
      "elements": [{ "sectionId": "section-main" }]
    }
  ],
  "accessRules": [],
  "signals": {
    "stopLines": [
      {
        "id": "stop-entry",
        "edgeId": "entry",
        "location": "edgeEnd"
      }
    ],
    "maneuverGates": [
      {
        "id": "gate-controlled",
        "maneuverPathId": "path-controlled",
        "transitionIndex": 0,
        "stopLineId": "stop-entry",
        "signalControl": {
          "kind": "group",
          "groupId": "main"
        }
      },
      {
        "id": "gate-uncontrolled",
        "maneuverPathId": "path-uncontrolled",
        "transitionIndex": 0,
        "stopLineId": "stop-entry",
        "signalControl": {
          "kind": "none"
        }
      }
    ],
    "groups": [
      {
        "id": "main"
      }
    ],
    "controllers": [
      {
        "id": "controller-main",
        "kind": "fixedTime",
        "offsetMs": 1000,
        "groupIds": ["main"],
        "phases": [
          {
            "id": "green",
            "durationMs": 30000,
            "states": [
              {
                "groupId": "main",
                "aspect": "green"
              }
            ]
          },
          {
            "id": "yellow",
            "durationMs": 3000,
            "states": [
              {
                "groupId": "main",
                "aspect": "yellow"
              }
            ]
          },
          {
            "id": "red",
            "durationMs": 20000,
            "states": [
              {
                "groupId": "main",
                "aspect": "red"
              }
            ]
          }
        ]
      }
    ]
  },
  "parking": {
    "areas": [
      {
        "id": "lot-main"
      }
    ],
    "spaces": [
      {
        "id": "lot-main-01",
        "areaId": "lot-main",
        "entry": {
          "edgeId": "entry",
          "progress": 12.5
        },
        "exit": {
          "edgeId": "through",
          "progress": 4.0
        },
        "geometry": {
          "lateralOffset": -3.0,
          "headingOffsetRadians": -1.5707963267948966,
          "length": 5.0,
          "width": 2.4
        }
      },
      {
        "id": "lot-main-02",
        "areaId": "lot-main",
        "entry": {
          "edgeId": "entry",
          "progress": 25.0
        },
        "exit": {
          "edgeId": "entry",
          "progress": 25.0
        },
        "geometry": {
          "lateralOffset": 3.0,
          "headingOffsetRadians": 0.0,
          "length": 5.2,
          "width": 2.5
        }
      },
      {
        "id": "curbside-01",
        "entry": {
          "edgeId": "bypass",
          "progress": 8.0
        },
        "exit": {
          "edgeId": "bypass",
          "progress": 8.0
        },
        "geometry": {
          "lateralOffset": -2.5,
          "headingOffsetRadians": 0.0,
          "length": 5.0,
          "width": 2.2
        }
      }
    ]
  }
}
